{"teachers":[[4458,6],[127,3],[3234,3],[3243,2],[3745,2],[4385,2],[5797,2],[822,1],[1580,1],[2644,1],[2809,1],[3535,1],[3581,1],[3903,1],[3933,1],[4290,1],[4894,1],[5261,1],[5914,1],[6535,1]],"students":[[3409,4],[2478,3],[12105,3],[234,2],[2588,2],[1611,1],[1743,1],[2747,1],[3654,1],[4424,1],[4601,1],[4722,1],[5156,1],[5561,1],[6709,1],[6923,1],[7130,1],[7182,1],[7340,1],[9309,1]],"cl_groups":[],"dropped":[]}