{"teachers":[[3732,171],[4458,4],[3807,3],[1091,1],[1389,1],[1582,1],[2767,1],[3320,1],[3655,1],[4677,1],[15811,1]],"students":[[4822,150],[5183,41],[4908,21],[17150,5],[5399,3],[7187,3],[7551,3],[2609,2],[2644,2],[2837,2],[3911,2],[4385,2],[5914,2],[2,1],[261,1],[644,1],[857,1],[1098,1],[2472,1],[3037,1]],"cl_groups":[["tk-12917",77,97],["tk-73805",77,97]],"dropped":[[2,"negative_cycle"],[2472,"negative_cycle"],[4677,"negative_cycle"],[6785,"negative_cycle"]]}