{"teachers":[[3644,18],[2638,11],[2959,4],[6932,4],[5860,3],[644,2],[1513,2],[5808,2],[6185,2],[6717,2],[1946,1],[2690,1],[4035,1],[4851,1],[6875,1],[7046,1],[16721,1]],"students":[[6401,12],[38,6],[4072,6],[588,4],[2822,3],[3928,3],[4980,3],[3919,2],[16370,2],[17476,2],[1,1],[1270,1],[1543,1],[3393,1],[3460,1],[4040,1],[4074,1],[4203,1],[4472,1],[4814,1]],"cl_groups":[],"dropped":[[1,"negative_cycle"],[15071,"negative_cycle"]]}